Review date,Reviewer name,Review title,Review body,Ratings
22-04-2021,WandaWanda,,ive used this brand forever disinfect so well,5
22-04-2021,JOANNEJOANNE,,"These  Clorox disinfecting wipes are great.  I just love them and due to the Pandemic, they are very hard to find.  I am, however, disappointed that the wipes were delivered to me without being packed in a cardboard box.  They were just sitting on my porch, without the benefit of being packed in a box.",5
21-04-2021,ccmccm,,"These help but still somehow we got a stomach virus and we use these and the sprays, and swifter pads every day",5
21-04-2021,sandrafloerkesandrafloerke,,good. disinfectant. esential item,5
21-04-2021,NamaNama,,I use these to keep everything sanitized . In my home with the pandemic and also used before .,5
20-04-2021,MissHeatherMissHeather,"Been a staple MANY MOONS,waay b4Covid...",These have been MY GO TO since many many MOOONS before Covid EVER came along!! Kept my family safe since and before!  Ill ALWAYS have these on hand!,5
20-04-2021,mayramayra,Good product..Terrible packing,"I love Clorox Wipes..BUT I ordered this online..and the packaging was awful..Walmart did not cover it with another plastic bag and the person who packed put it the worng way..sooo Water was in the box..and other items were wet,
Please take note of this in order to teach the packing peopleLikesBathroomVirusesEaseShapeReliability",3
18-04-2021,JimJim,FAST AS LIGHTENING!!!!!,SPEEDY DELIVERY and Cannot be Happier!!!  Thanks so much!!!  WE LOVE WALMART!,5
18-04-2021,Adie56Adie56,Disinfectant Wipes,"Because of COVID especially, I am grateful for disinfectant wipes and glad they are back on the market.  Also, I have had cancer and like to disinfect counters, steering wheel in my car, phone and purse.",5
18-04-2021,jeffjeff,,Wonderful to keep everything clean and safe,5
18-04-2021,ChinaChina,Pass the wipes.,I want my house fully protected and sanitized during Covid.,5
16-04-2021,FgnFgn,Good items,Good purchase for the price and shipping good,5
13-04-2021,AndreeaAndreea,,I use them all over the house,5
12-04-2021,MsisMsis,Good item,Great for sanitizing. Not to small not to big.,5
12-04-2021,memawmemaw,Sanitary wipe ups,Handy to keep in the bathroom and kitchen for wipe ups!,5
12-04-2021,BethanyBethany,Finaly been able to get these,I just glad I finally was able to get these since the pandemic started I have not been able to get any I need these for my own medical conditions . I get Mrsa out breaks  often I had so many of them since pandemic started and have not been able to disinfect anything I touched so I kept getting the infection. So I am just glad I finally able to get some of them. Mrsa when you have a Mrsa out back or flare up your consider very contagious.,5
11-04-2021,PhyllisPhyllis,Dont understand why buy a 3 pack,They came not in one pack together all 3 Came separate,1
11-04-2021,LonniferLonnifer,Love this brand,Always have trusted Clorox brand. Haven't used yet. Love lemon scent from previous uses.,5
11-04-2021,NancyNancy,Back in Stock,"Tough to find. First time finding in more than a year,LikesShapeEase of useFeaturesStrength",5
10-04-2021,TRPTRP,Refreshing and trustworthy,"Name brand that has been known in the cleaning industry for years.    These wipes are a good size, and come out of the container without rubbing or tearing on a rough plastic like the less expensive brands.   They are easily torn apart on taking out of the container, where as some other brands many cloths are wasted because 3-5 come out at once.     There is a nice, refreshing scent without being too harsh and abrasive.    Also, the individual cloths are moist so you know you are getting some cleaner with them.    Most other brands come out dry.   I've even had to pour more cleaner in half used containers of other brands directly over the cloths because they were dried out. 
   Waste of money.      During this time of Covid we have depended on these and had a container in almost every room, as well as the car.   We simply trust them.  And, will continue to have available in our home long after we get back to ""normal"".See more",5
10-04-2021,lizard55lizard55,Awesome clean,Smells good and they disinfect,5
10-04-2021,YoshiraYoshira,Great Product!,Product is great! only issue was either the packaging or delivery service since I ordered 2 packs one of them came soaked not sure If it open and spilled all over or of there was a hole.,4
09-04-2021,kimkim,Clorox the cleaner clean,Clorox has always been a good man and the whites are even more convenient very moist it does the job wellLikesCountersQualitySpeedEnvironmentBacteria,5
08-04-2021,JoJo,LOVE THEM!,THESE  WIPES DOES IT ALL. I SIT OUTSIDE ON THE PATIO NOW AND USE THESE TO WIPE OFF THE CHAIRS AND SMALL TABLELikesSurfacesAccessLiquidCleanlinessFeatures,5
08-04-2021,DedieaDediea,Great Selection,Fast delivery and excellent price,5
08-04-2021,HildyHildy,,Great quality and product!,5
07-04-2021,DebbieDebbie,Back in Stock!,"So pleased they are back in stock. Able to complete my order before getting the ""I sorry this item is no longer in stock"" message. Quality as expected.",5
07-04-2021,DianaDiana,Poor packaging for the Clorox disinfecting wipes,"I just received this order delivery today and I have to tell you that Im so disappointed with regard to the packaging.  The box was wet on one side and I could smell the strong contents of the Clorox disinfecting wipes coming from the inside!  I had not opened the box at that point but the smell was so strong so you can imagine once I did open the contents!  Paper was inserted into the box but there was no other type of wrapping other than what the item came with.  The contents was soaked and two of the containers lids were slightly opened!  Liquid was all over, it was a huge mess!!  Needless to say I will not be ordering this item from Walmart in the future!  With COVID-19 in effect and being handicapped I thought ordering any product would be safe not to mention convenient, but little did I know I was wrong!!  I have ordered laundry soap liquid as well as other types of liquids and have not experienced this issue!  Not happy with this at all.  Im hoping that when I do use the item there will be liquid left inside that keeps the wipes moist!See more",1
07-04-2021,SandySandy,,Love Clorox wipes !  Great product!,5
06-04-2021,StephanieStephanie,,The inside of the box was wet. The labels on the clorox containers are coming off from being wet. The wipes seem to still be wet but I'm afraid they may not be as effective if the wetness is from the wiped themselves.,1
05-04-2021,GRACEGRACE,,Great for cleaning and disinfecting,5
05-04-2021,NicoleNicole,Clorox Wipes - Good Buy,This was my first time trying this product and I really liked it.  The texture is great and the little ridges made it felt more like a thin towel than a wipe.  I will definitely buy it again.,5
05-04-2021,Lody27Lody27,Powerful wipes.,The best wipes and kill bacteria.LikesRemovalFeaturesFor spotReliabilitySpillsAppearanceConfidenceCleanlinessSanitizingSturdinessChairFor the classroomStrengthKitchenCounters,5
04-04-2021,leeglleegl,a good buy,I purchase these all the time and like what I see.  You can use them for any cleaning project you have around the house.LikesSentEase of useFor schoolContainerKitchen,5
04-04-2021,HelynHelyn,Glad these are back,"So happy to get these Clorox wipes. They became a fixture on a several counters in my home over the years. Yes I know there are other brands available, but Clorox has/is my go to wipe with confidence.LikesConvienceReliabilityHealthConvenienceFreshnessConfidenceFor spotCountersVersatilityTouch",5
03-04-2021,MinnieMinnie,,They fine except one containers lid is broken and leaked inside of shipping box,3
03-04-2021,Raynelove19Raynelove19,Great price and quality,"This is definitely a quality buy for a great price! Especially with all that has been going on with quarantine and health changes worldwide. No complaints here, satisfied customer! Keep this in stock please we need it.LikesAppearanceReliabilityHealthSurfacesSanitizingFeelingFor the classroomStrengthCleanlinessQuality",5
01-04-2021,tomvilla60tomvilla60,Thorough cleaning satisfaction,Makes cleaning easier and I know it is the cleanest it can be .,5
31-03-2021,LindaLinda,Bleach wipes,"Very pleased, availability, we needed bleach wipes because of an infection someone in the family had and you can always know that Clorox works.LikesAppearanceViruses",5
31-03-2021,BelindaBelinda,Excellent product,Great product and perfect for my needsLikesDispenserShapePerformanceHandleHealth,5
31-03-2021,PriscillaPriscilla,SO PERFECT!,Good product and I love it! The surrounding inside my house it feels clean after I used this Clorox disinfecting wipes. It helps also to prevent bacteria or germs.,5
30-03-2021,AishaAisha,,Too expensive for only a 3 pack.  Sam's carry it 5 pack for 10.00 and here 10 for only 3,1
30-03-2021,KristieKristie,Great,Always loved Clorox products!LikesSafetyFor the officeConvenienceTouchBacteria,5
30-03-2021,GuadalupeGuadalupe,,Great for cleaning anythingLikesFor the classroomPerformanceSurfacesCleanlinessEnvironment,5
29-03-2021,GinnyGinny,,Works great to clean everything,5
29-03-2021,RachelRachel,Where have you been? Clorox?,"As we all know, during COVID-19, everything Clorox disappeared. Now that I'm able to re-purchase, I bought a three pack of these to have on hand. Honestly, because I had to make do with Lysol instead of Clorox through the pandemic, I now prefer Lysol. The Clorox wipes actually stink, as in smell.",3
29-03-2021,RickRick,A welcome return.,"These are great wipes. When Covid hit these disappeared, and Im so happy to see them back. So convenient and powerful. Thanks for bringing them back!LikesSurfacesChairAccessBacteriaDislikesFor pets",5
28-03-2021,MSGE55MSGE55,Clorox Wipes,It was great. About to go into the house when the young delivery lady was dropping off my delivery packages.,5
28-03-2021,beatrizbeatriz,Bust a quicky,They work great for those times unexpected company shows up and you want to give everything a fast wipe.,5
27-03-2021,sef3sef3,"Clorox Disinfecting Wipes,",These are great for clean up and the smell is not strong,5
25-03-2021,ElizabethElizabeth,,Product is good. I want to give a big thanks to the delivery person who delivered it to my front door.,5
25-03-2021,CandyCandy,"Thank you, thank you, thank you!",I AM FULL OF JOY THE DISINFECTANT WIPES ARE OUT!   I WANT TO DO CARTWHEELS RIGHT NOW!  LOL!,5
25-03-2021,JacquelineJacqueline,,Kills germs. Removes dirt and grim.LikesSizeSmell of bleachStrengthRemoval,5
24-03-2021,amym370amym370,Wonderful product! I use,Wonderful product! I use these wipes daily to disinfect things within my home and in my classroom. They smell nice and the chemicals are not overpowering when cleaning around children.,5
24-03-2021,GazeboGazebo,,"Happy finally available again, price did go up a few dollars.LikesFor travelQualityGreaseFor the classroomViruses",5
24-03-2021,CheriseRCheriseR,,"wipes worked as expected and appeared as shown on site, thanks!",5
24-03-2021,NoneNone,,Clorox has been a staple in my home a long time.LikesReliabilityKitchenSmell of bleachPortabilityCleanliness,4
24-03-2021,katlynnshawnpkatlynnshawnp,I use these to,"I use these to wipe everything down everyday and the smell is amazing and they are long lasting I highly recommend to use these to stop the spread of virus and other germs that need to be gone so these at 100% effective and I do buy them everytime I run out CPC BLYSOW Lysol Disinfecting Wipes Lemon 75-Wipe Scent, Case of 6",5
23-03-2021,jessicaw826jessicaw826,I always try to,"I always try to have these Clorox disinfecting wipes on hand in our household. I love the fresh lemon scent that makes the house smell extra clean.  The container is convenient and easy to use, especially when cleaning spills and messes.  Try these!",5
23-03-2021,SchieberSchieber,,I could have danced for joy when I was finally able to purchase these. Waited patiently through the whole pandemic to be able to get them. Thank you,5
22-03-2021,roseofsharon55roseofsharon55,,"Always liked them, always will, everything so clean",5
22-03-2021,artgal7artgal7,The BEST Brand available by far!,There's no better product for disinfecting wipes that clean also than Clorox Disinfecting Wipes. I'm so happy that they are finally becoming available to the general public again.LikesCleanlinessCountersSafetyHealthCanisterSheetsEffectiveness,5
22-03-2021,PeggyAnnPeggyAnn,Awesome,Love your availability of all products I want.LikesRemovalAccessSurface areasKitchenCanister,5
21-03-2021,TamishaTamisha,,Loved that I could order thisLikesSmellSizeSanitizing,5
21-03-2021,SmartValueBuyerSmartValueBuyer,Good Wipe for the going-on pandemic,Very pleased to find this at Walmart.  This brand always gives me the peace of mind.LikesCountertopsFor the classroomGreaseEaseQuality,5
20-03-2021,pjh1pjh1,Nana,Love the lemon fresh; I have one in the kitchen and the bathrooms also.,5
19-03-2021,NilsaNilsa,Very Satisfied,What I like about this product is that its finally available in bulk size yay!!!!!,5
19-03-2021,franklinmullarfranklinmullar,Very nice product....good for,"Very nice product....good for disinfection surfaces at home, I have one in my home and my office. I highly recommend",4
18-03-2021,GwenGwen,,"Excellent for wiping down doorknobs, sinks etc and smells good!",5
17-03-2021,KellyKelly,,lid of the middle container was cracked/broken.   Items were placed in the box on its side so liquid leaked all over the box and other containers.  I assume these wipes will dry up quickly and be useless for me.,1
17-03-2021,QueenbutterflyQueenbutterfly,,"Great wipes, exactly as ordered!",5
17-03-2021,GuadalupeGuadalupe,,Clorox is extremely helpful for cleaning and sanitizing. I personally love this product.LikesGreaseConfidenceSentBacteriaKitchenReliabilityCleanliness,5
17-03-2021,mayurip5mayurip5,These are portable and,These are portable and easy to use. They smell great and are great for disinfecting surfaces on the go.,5
16-03-2021,BenjaminBenjamin,Good item,I really like my whips because helps with this virus,5
16-03-2021,cottoncandycottoncandy,,these are the only one i like but i do like the cheep ones but the name brand seem to work more better than the store brnd one,5
16-03-2021,swampswamp,great,make cleaning so much easier,5
15-03-2021,StyleLoverStyleLover,Famous Clorox Disinfectant Wipes!,Clorox disinfectant wipes are the best brand and product out there to help fight germs.  We all need this to be used at home in office or on the road... It is still not yet widely available for public yet.,5
14-03-2021,4JenniferT4JenniferT,,Feel confident in it's disinfectant ability.LikesConfidenceKitchenAppearanceSurfaces,5
14-03-2021,Solseg78Solseg78,,I really like how the Clorox wipes disinfects and the price is a good deal.,5
13-03-2021,Olivia90670Olivia90670,Product is amazing!!,"I use these on a daily love the fresh lemon scent. I use them in the kitchen, restroom, table etc!!",5
13-03-2021,PassionPassion,Easy on the touch,These are easy for the kids with the epidemic theyve been trained to wipe door knobs toilet seats ect,5
13-03-2021,JoyJoy,Not happy,Left a big mess when shipped.. They should have taped the top lids so the liquid inside the container did not leak all over the box,1
13-03-2021,donthaveonedonthaveone,,Nice to have on hand for easy cleanup,5
12-03-2021,SheriSheri,Need better Walmart shipping packaging.,Love love love Clorox wipes but Walmart just throws it in the box any ole way,4
12-03-2021,tamaratamara,,Works just as good as the Lysol wipesLikesHealthSinkFreshness,5
12-03-2021,MaryAnnMaryAnn,Great,"Delivery guy set the box upside down, i had a mess to clean up when I went to unbox these",5
12-03-2021,fairskinnedblondefairskinnedblonde,I love using my,I love using my Clorox wipes. I use them in my kitchen and my bathroom. They clean everything and I love the lemon scent. I even will wipe up my tile floors in my bathroom in between mopping. Buy and use them all the time scentiva clorox disinfecting wipes,5
12-03-2021,LanLan,,Love this. So thankful that my shipment came! Thank you.,5
11-03-2021,GwenGwen,Great  price,"Great, I finally for first time able to receive Clorox wipes since covid",5
11-03-2021,tee_lotee_lo,I really like these,"I really like these bleach free wipes. They clean just as well without the harsh smell.  These are the only wipes I will use,  so I stock up when I can.",5
10-03-2021,tobbytobby,Good product,The softness and the clean smellLikesFor the officeWaterSturdinessEnvironmentCleanliness,5
10-03-2021,68Unhappy68Unhappy,,My go to cleaning product,5
08-03-2021,GaryGary,Clorox Disinfecting Wipes,I was glad to be able to purchase this hard-to-find product at a reasonable price.LikesFor the classroomSanitizingSafetyVersatilityEffectiveness,5
08-03-2021,ACAC,,be aware of the products may ''leak'' due to the transportation,5
07-03-2021,TdTd,Can't not beat Clorox,Clean you with these Clorox wipes if you get in my way.,5
06-03-2021,redirocz28redirocz28,"So, so needed","I have asthma, so there aren't many chemicals I can clean with. This is one of them. They got so expensive I've been doing without. They finally got some on Walmart.com and I snagged them. I keep one in every room.",5
06-03-2021,KeslerKesler,,Use it too clean almost everything.  Good amount for the price.LikesSentFor fluConvinceSanitizingFor the office,5
04-03-2021,DominickDominick,Good price,Great deal and smell goodLikesSheetsEase of useDispenserFor school,5
02-03-2021,SarodaSaroda,Good deal great price,"Good deal great price , thank you Walmart for not price gouging I'm so glad I was able to get this at a reasonable price.",5
02-03-2021,WendyWendy,,"Perfect! 
And the delivery was perfect, as well!",5
18-02-2021,ferrnandalalaferrnandalala,Must have always !,Must have always ! Especially nowadays where there's just even more germs and nasty stuff out there. these are super easy to use I just love them I just grab one and wipe I don't have to worry about spraying I don't have to worry about anything else and I also like to carry one in my car just in case I need it and they don't dry out they stay wet and moisturized which I love,5
17-02-2021,shereens11shereens11,Easy to use. The,Easy to use.  The smell is fresh. More cost effective than competitors yet feel there is no compromise in quality.,4
17-02-2021,alimweber_alimweber_,These Are of course,"These Are of course the go to for easy sanitizing, quick clean up of anything. I always have to have these in my home. I don't always buy this exact scent anymore now since they have come out with some different ones, but just these wipes in general are always a must. Especially with this virus now and if you have kids. I like to keep a small pack in my car too. The only reason Im giving it 4 stars is because of that annoying packaging on the big pack. Sometimes you go to pull out one and it's like a zillion come out with it. Other than that very minor issue, no complaints.See more",4
17-02-2021,zaliaizaliai,Always have the wipes,Always have the wipes disinfectant at home. It's great to clean up kitchen areas and the bathroom.,5
17-02-2021,shayeeeshayeee,I use these everyday,I use these everyday & they never disappoint. Great for quick clean up & I love this scent. One sheet goes a long way.,5
17-02-2021,natalier147natalier147,I love that it,I love that it has the little ridges so it helps scrub away the germs I like that one goes a long way,5
16-02-2021,patricial90patricial90,The best product to,"The best product to cleaning  up quick, I use it for many things such as cleaning any surface.
They clean very well and the smell is excellent!",5
16-02-2021,AngelAngel,Love these,These wipes do the trip especially for disinfecting. Ive been using these a lot especially since Covid-19. Keep some in your car and at home. They even have some you can travel with! Its a life saver.LikesToiletSinkCleanlinessSpills,5
16-02-2021,ashleyxkimashleyxkim,These were so hard,These were so hard to get ahold of during the lockdown but I'm so glad I got them back in stock. Easy to clean with,5
16-02-2021,faithferrissiglerfaithferrissigler,I really love clorox,I really love clorox wipes they clean very well and the smell is excellent. I pretty much clean my whole house with them that how much I love them...,5
12-02-2021,WalmartCustomerWalmartCustomer,Because..COVID,"Yes, we are those people that wipe down their groceries and every package.  These wipes are a staple during these unstable times.  We actually use these for a lot of our cleaning.  Disinfecting counters after we prep raw meat...Cleaning up the toddlers potty seats...bathroom disinfectant.. Wipe down of all communal surfaces. Great multipurpose wipes for the germaphobe.",5
11-02-2021,rebeccaw113rebeccaw113,Love the way they,"Love the way they smell and more importantly, I love the way they clean and make me feel like I'm keeping my family safe!",5
10-02-2021,stephanieb400stephanieb400,I use this product,I use this product to clean my whole house from top to bottom and I highly recommend this product to everyone because it disinfects for viruses,5
10-02-2021,priscilaz3priscilaz3,I use these for,"I use these for almost everything! Door knobs, countertops, toilets everything￼￼. These get sold out so fast that's how good they are",5
10-02-2021,feelaspeaksfeelaspeaks,Great for quick cleans,Great for quick cleans around the house. I love these to wipe down the bathroom in between deep cleaning,5
08-02-2021,cheeriotheshibainucheeriotheshibainu,Excellent product if you're,"Excellent product if you're lucky to find it. Mom has been using it to wipe my paws after our walk and has worked great to kill germs I may pick up.  It's not organic, free from chemicals but our goal is to keep all pathogens away from our home.  5 solid stars. Woof!  IG: @cheeriotheshibainu  

Clorox Disinfecting Wipes Bleach Free Cleaning Wipes - Crisp Lemon - 75ct",5
08-02-2021,marcyac245marcyac245,Great clean. Great smell.,Great clean. Great smell. Trusted brand. I love these are so easy to use. I keep one in the kitchen and in each bathroom. Deep clean feel without the deep clean effort.,5
07-02-2021,WalmartCustomerWalmartCustomer,I love using these,I love using these wipes to clean with! They make it so easy to clean with even having a rough side. The only downside of these wipes is they leave some bubble residue behind and dirt when they get dirty.,4
07-02-2021,michellec0309michellec0309,This is my favorite,This is my favorite brand of disinfectant wipes. They can be a bit pricey but I've tried other products and they just dont measure up to the Clorox brand.,5
07-02-2021,darcyl6darcyl6,These have been great,"These have been great to keep on hand if we can stock up on them through the pandemic. We wiped down countertops, door handles, you name it.",5
07-02-2021,peaceheartpeaceheart,These were possibly literally,"These were possibly literally a lifesaver during the pandemic. When stores were out of stock I had my mom send me some in the mail. Great to wipe off all surfaces in the house, and your phone!",5
07-02-2021,gabriellam56gabriellam56,So convenient for easy,So convenient for easy clean ups! I always love having Clorox wipes in the kitchen to clean up the counters or wipe down my daughters high chair!,5
07-02-2021,aritzabelaaritzabela,I love this clorox,"I love this clorox wipes , I have a Airbnb and this is perfect to clean it everything also I use in my own house",5
06-02-2021,kristaf17kristaf17,These work really well,"These work really well for quick disinfecting needs, and they're super convenient to have in every room. We even keep some in the car for those times you need them when you're out and about.",5
06-02-2021,marissam141marissam141,Love these. They are,Love these. They are convenient when I wanna clean up messes quick and disinfect at the same time,5
06-02-2021,BessieBessie,,Container was busted ! Leaked liquid on my charcoal Briquets . Poor packaging. If it's busted please don't ship.,1
06-02-2021,brianadarlenemuabrianadarlenemua,"Growing up, we never","Growing up, we never had Clorox wipes in my house. I'm not sure why. It wasn't until I started teaching that I really started to use them, and I'll never go back. You think something looks clean, then you use one of these, and the amount of dirt them comes off on it is mind blowing",5
06-02-2021,arkansasgalsarkansasgals,Great to clean toilets.,Great to clean toilets. Cleans like a dream and smells good too. Great for killing germs,5
06-02-2021,mollyc79mollyc79,These are a necessity..,These are a necessity.. especially 2020 and 2021. You all know!! These work and were once very valuable if you could find them in the store!!,5
06-02-2021,WalmartCustomerWalmartCustomer,My favorite disinfecting wipes,My favorite disinfecting wipes they smell good and they work perfectly for this hard times,5
05-02-2021,GaleGale,I hope Walmart keeps selling them.,"Clorox wipes are hard to find now a days, so 
I am very happy that Walmart is selling them online.LikesConfidenceHealth",5
05-02-2021,robertah11robertah11,This is a necessity,This is a necessity at my house and I love all of the wipes that Clorox makes. Especially since COVID.,5
05-02-2021,alexandriaj13alexandriaj13,I use basically all,"I use basically all of Clorox's disinfectant products and more! These wipes smell amazing & are easy to use! Clean your house, toys, car, and so much more!",5
05-02-2021,kayleneg2kayleneg2,Who doesn't love Clorox,Who doesn't love Clorox wipes for a quick & easy disinfectant? Especially during recent times. I use these the most in my bathroom and kitchen to clean surfaces and disinfect thoroughly! I like the lemon scented ones but they all do the trick.,5
