Review date,Reviewer name,Review title,Review body,Ratings
05-02-2021,thatgrlstephthatgrlsteph,We love to use,We love to use these to keep kitchen as well as bathroom counters clean especially with this pandemic. Clorox Disinfecting Wipes Bleach Free Cleaning Wipes - Crisp Lemon - 75ct,5
05-02-2021,littleprincesslittleprincess,I use Clorox wipes,I use Clorox wipes to clean surface areas that need a little extra protection. The fresh lemon scent is an added plus.,5
05-02-2021,WalmartCustomerWalmartCustomer,Love the scent and,"Love the scent and ease of use. Don't always care for the price. Hard to find since Covid started, but definitely grab my allowance when I do!",5
05-02-2021,latinachikaslatinachikas,A must with the,"A must with the global pandemic that is COVID 19. It is, of course, hard to come by. One of the very few products that accuracy kill COVID 19. I need it and I love it!!!",5
05-02-2021,nativenycfoodienativenycfoodie,I love to use,I love to use this to clean up any quick messes. This is my go-to disinfectant wipe. I definitely recommend this product,5
05-02-2021,TanyaTanya,,Good cleaning item during this covid-19! Thanks for having in stock!!!,5
04-02-2021,jonshjonsh,If you don't have,"If you don't have this in your life, you are truly missing an essential product. Works perfect on everything especially during covid. I've been using this product for years  and it still amazes me. Keeps everything clean and kills viruses and bacteria.",5
04-02-2021,kimberlywestlundreevkimberlywestlundreev,"In this Covid world,","In this Covid world, we go through these so quickly! They smell good, work, and don't burn my hands even if I use for awhile on various high touch surfaces. As a mom, I feel better using these knowing my house is as germ free as possible. We also sanitize our groceries with these...lol",5
04-02-2021,sarikassarikas,I love using Clorox,I love using Clorox wipes especially in the bathroom it feels like does such a thorough job and you can really see results. I previously used different products to clean with and I never got as good as clean as I have with this product.,5
04-02-2021,sam_veri5513sam_veri5513,Who can have anything,Who can have anything bad to say about Clorox wipes when they were once so hard to find? I love using these as I am pregnant and can not clean with strong bleach products. My go to for the bathroom and kitchen messes!,4
04-02-2021,ashleyb66c8ashleyb66c8,These are my go,These are my go to for cleaning up quickly & just wiping down any areas especially the kitchen counters & stove top I feel like they smell great & make it seem clean I've bought them many times & I'll continue to buy them,5
03-02-2021,rebeccav51rebeccav51,Definitely use these often,Definitely use these often especially now during covid... we are constantly wiping down things,5
03-02-2021,kadenceekadencee,these are so good,these are so good around the house! you can clean anything from counter tops to your bathroom sink!!,5
02-02-2021,sarahm777sarahm777,I've used these all,I've used these all throughout the pandemic. I don't know what I would do with out them! They are very moist and will clean any surface with out a doubt.,4
02-02-2021,sabrinagc736sabrinagc736,These are great when,These are great when you can find them. I never knew I'd miss something as much as I have Clorox wipes. I love these for everything from cleaning up the kitchen after cooking to cleaning light switches and door knobs to toilet seats. I'll be so glad when they are easy to find again. Others on the market do not match up to Clorox.,5
02-02-2021,amberw4amberw4,I love using this,I love using this for small spills in the kitchen. I also use it to clean my bathrooms. I love the scent and it is tough. There isn't anything I would do to improve it. It is a good value for the price. I have bought this before and I will buy it again in the future.,5
02-02-2021,glossbglossb,I have one of,I have one of these in each bathroom & kitchen. Great disinfectant. Wipes away gems & dust. A household staple,5
02-02-2021,singlemomreviewsinglemomreview,I love these wipes!,I love these wipes! They are an amazing cleaner & the smell leaves everything smelling fresh!,5
01-02-2021,ZEBJZEBJ,The best wipes,So glad to finally be able to get these,5
31-01-2021,rachelt0825rachelt0825,I love wipes. They're,I love wipes.   They're the greatest invention.    They work at home or work.  Easy to use.   I love to use them to clean a spot or to just clean up.,5
31-01-2021,kimy1kimy1,Love this product. Easy,Love this product. Easy and quick cleaning. Help keeps the house clean. Scent is light,5
31-01-2021,jcdnycjcdnyc,I got lucky to find these,Great price and I was so happy to find Clorox!!LikesSizeEnvironmentPerformance,5
31-01-2021,brittanywa184brittanywa184,This is the best,"This is the best product and sometimes the only product I use to clean. I use this in the bathroom, kitchen and to wipe down surfaces touched a lot. I wouldn't change anything about it. I will continue to use this product for as long as I can, and as long as I can find it",5
31-01-2021,valeriew32valeriew32,These disinfecting wipes clean,These disinfecting wipes clean surfaces well and leave you confident that the germs are gone after use.,5
31-01-2021,WalmartCustomerWalmartCustomer,"Counters, toys, bathroom counters,","Counters, toys, bathroom counters, pantry shelving, and sinks! You name it we've wiped it with these wipes! Especially with this COVID pandemic, we wipes every chance we get. These wipes helps us feel and stay clean also the facet that the cnnister is so easy to pop open and pop shut helps a great deal.",5
31-01-2021,calianacaliana,Clorox wipes are a,Clorox wipes are a well-known brand with a decent price. They clean and disinfect surfaces like nobody's business. I use them on mostly all of the surfaces in my household. I like that they're in a handy container easy for storage.￼￼￼￼ I Do not know what I would do without them right now during this Pandemic. I would recommend these Clorox Disinfecting wipes to others. I will continue to purchase them to fight germs in my house.￼,5
30-01-2021,AllforCanonAllforCanon,,The box was wet! Immediately opened it all the bottles were open and drained! The wipes are dry! Sad! Especially for an item in high demand!,1
30-01-2021,adrianap111adrianap111,I am OCD clean,I am OCD clean and I love my house to smell fresh and clean and these Clorox wipes make me feel safe especially with Covid right now. They clean very well and sanitize just as well,4
29-01-2021,rociom119rociom119,they smell super good,"they smell super good and I trust that it disinfects my places after using it, I recommend in the kitchen because of the bacteria",5
29-01-2021,emmat115emmat115,Best wipes and especially,Best wipes and especially now during covid. Hard to get your hands on tho. Smells great too!!!,5
29-01-2021,KishaKisha,Surprised these were in Stock!!!,I'm so glad these are back in stock. I ordered one. I was almost running out and need this with CoVid 19 going on.,5
29-01-2021,jamieg89jamieg89,I literally use these,"I literally use these clocks wipes to clean everything , my counter tops , my dining room table , my phone . I can not live with out clod wipes !",4
28-01-2021,chanachana,,They do the job but would appreciate them thicker and wetter.,3
28-01-2021,mishas5mishas5,I use this to,"I use this to disinfect the grocery wrapping or boxes during the pandemic, also counter top",5
28-01-2021,courtneyc215courtneyc215,Works good but very,Works good but very hard to find with covid 19 . Use it for everything though bathroom and kitchen especially,3
28-01-2021,tracyb75tracyb75,So convenient for messes,So convenient for messes and general cleaning especially when you are in a hurry. I always try to keep some on hand,5
27-01-2021,dlkinycdlkinyc,Best tool for keeping,Best tool for keeping all surfaces clean and germ free .  Fresh scent makes it better.,5
27-01-2021,poutypuffgirlpoutypuffgirl,Favorite disinfectant wipes. Makes,Favorite disinfectant wipes. Makes my house feel clean for quick everyday wipe ups. Good pricing. Good amount in each container. All around- just good.,5
27-01-2021,lizrulezlizrulez,During this pandemic i,"During this pandemic i have been using these to clean everything from my surfaces,groceries, keys,and shoes they do the job well and I feel better about my family's health and safety",5
27-01-2021,melanieheintzmelanieheintz,I trust Clorox wipes,"I trust Clorox wipes to disinfect the house, door knobs, keys and other things that could bring germs into our house. The fresh scent is appealing.",5
27-01-2021,makeyawmakeyaw,Best cleaning wips a,Best cleaning wips a girl could ask for .they get the job done just right for just wiping your night stands off,5
27-01-2021,taylormarie1517taylormarie1517,Clorox Disinfecting Wipes with,Clorox Disinfecting Wipes with bleach works very good for cleaning small areas after your kids eat on the tabel or after you spill a drink. One or two whipes should be enough to make it clean and disinfect the area. Since the virus is going around it's good to have these on handy to also whipe your sternwheel off with or etc. I recommend Clorox whipes.,5
27-01-2021,TomoyaTomoya,Stay clean everyone,Proper wipes  always beat disinfecting sprays since it physically removes dirt and infectious elements.,5
26-01-2021,sweetbaboosweetbaboo,Good formula but poor execution of dispenser,"Really like the product itself,  the formula and especially the larger top dispenser opening; however, the teeth of the opening where you pull the single wipes through always ends up ripping the wipes!  Company needs to work on the dispensing of the individual wipes to stop this.",3
25-01-2021,xcitingxciting,,good for removing small stuck on foods with scrubbing fibers,4
25-01-2021,Ang0303Ang0303,Best disinfecting wipes,Happy to have found these Clorox disinfecting wipes to order online. I like having these handy to wipe down everything with the covid and flu viruses. They smell good.,5
25-01-2021,michellem606michellem606,Clorox Disinfecting Wipes are,Clorox Disinfecting Wipes are bleach free and safe for kids and pets. They smell nice,5
24-01-2021,ChariettaCharietta,,Good for cleaning and disinfecting!!,5
24-01-2021,angelal6b66angelal6b66,These cleansing wipes are,"These cleansing wipes are so handy! One step instead of having to find a spray cleanser, grab paper towels, and lots of waste. These wipes clean well and don't leave any residue.",5
24-01-2021,taniaceee20taniaceee20,These are my favorite,These are my favorite because it leaves everything extra clean and it smells really good.,5
24-01-2021,urd2urd2,Hash brown used it,Hash brown used it for her explosice diahhrea she loved it it also killed her booty germs,5
24-01-2021,KCKC,Great for Handles,Yeah! So happy to finally be able to get these wipes. Most convenient for wiping down door handles.LikesBacteriaFor doorknobsCountersEase of useShape,5
24-01-2021,stephany0528stephany0528,This products smells great,This products smells great and gives Pierce of mine to dirty surfaces. We also have some in the car to wipe down the shipping cart before putting the littles under it. [product:2-pack-lysol-dual-action-disinfectant-wipes-lemon-&-lime-blossom-80-wipes-each],5
24-01-2021,amandac91387amandac91387,I'm obsessed with Clorox,I'm obsessed with Clorox wipes they smell great and clean surfaces and kill bacteria and germs.,5
24-01-2021,jessesamanthamjessesamantham,I love these wipes,"I love these wipes for big messes and little messes! They are especially great to have a round during this pandemic. I would absolutely recommend if you dont use these, to start!",5
23-01-2021,ashleyp397ashleyp397,Cloris wipes come in,"Cloris wipes come in different varieties of size and smells
 I always feel like I can use these to disinfect after chicken or something was on my counters and feel like they did what they say they do! I recommend for disinfecting and they smell good too",5
23-01-2021,nashlac1nashlac1,I feel very good,I feel very good with this product it cleans the tables well and I also use it to clean many things it is quite good it removes stains and dirt from things and you notice it instantly.,5
23-01-2021,britneyr29britneyr29,These are my go-to,"These are my go-to disinfecting wipes. I not only use these at home, but I also use them in my classroom. I feel confident about their ability to eliminate bacteria, which is a sigh of relief during the pandemic.",5
23-01-2021,ke55f7ke55f7,These always maintain a,These always maintain a good level of moisture without drying out quickly like other brands. It leaves a pleasant scent.  My one piece of feedback would be to try and make a version that's more eco friendly.,4
23-01-2021,RaynaRayna,Grateful,"Thankful to be able to get these and not be price gauged. Arrived quickly, packaged well",5
23-01-2021,kellierca47kellierca47,As a teacher I,As a teacher I use these daily. They are effective in killing germs and avoiding the spread of germs. It has a strong smell but not overpowering.,5
23-01-2021,carolinar0d2dcarolinar0d2d,These work great for,"These work great for any cleans Jos,  after lunch or cleaning up a messy kitchen ! Or even just to sa atize a surface !",5
23-01-2021,melissaw211melissaw211,Clorox disinfecting wipes is,Clorox disinfecting wipes is a must have in my hope. A quick easy clean and disinfect. The lemon smell is amazing. When they in stock I definitely grab.,5
22-01-2021,AnnetteAnnette,so clean,"Love these! I thought I ordered two, but didnt...",5
22-01-2021,MerrineMerrine,No protective seal!....,"I received my package really fast, so that's a plus but was so disappointed that every one of the containers leaked.  There is absolutely no protective seal on any of the containers so the liquid inside leaked all over them . It was a total mess. This is my very first purchase of this brand and unless the issue of protective seal is addressed it will be my last. I therefore could not in good conscience recommend this product to anyone.",2
22-01-2021,maddyk20maddyk20,"Always a go to,","Always a go to, leaves my surfaces feeling and smelling very fresh and clean. A reliable product that occasionally picks up stains or dirt while also disinfecting. Definitely a need right now for everyone",5
22-01-2021,ThomasThomas,,I was disappointed that it did not come in a four packLikesConvienceBathroomSurfacesKitchen,3
22-01-2021,RosaRosa,Clorox disinfecting wipes,"Love that Walmart has this wipes in stock during a pandemic. However, I wish Walmart was more careful with packaging/shipping as these wipes arrived leaking. I let them sit out until dry. Other than that, I would of given this product 5 stars.LikesTablesFor potty trainingValue for moneyKitchenQuality",4
21-01-2021,lorenamb1f5lorenamb1f5,I used this product,"I used this product to clean and disinfect countertops and other areas that need to be cleaned. The product is one of my favorites and the smell is not too strong. The wipes clean everything very well, especially with covid still around.",5
21-01-2021,ZedaZeda,Good!,I prefer these wipes for most of my chores at home and the delivery from Walmart was on time.,5
21-01-2021,HattieHattie,Best cleaning product,Been waiting forever for these wipes. They did not disappoint.LikesCleanlinessQuality,5
21-01-2021,PearlandMomPearlandMom,Great for disinfecting and cleaning.,Received these wipes in a timely manner.  They were a perfect addition to a teachers classroom.LikesDesksSafetyRemovalFor the classroomCanisterFreshnessValue for moneyFor fluReliabilityFor teachers,5
21-01-2021,ashantig1ashantig1,Especially in times like,"Especially in times like these Clorox wipes are essentially. The only thing is it may be hard to actually get them to the demand being so high. However, they work wonders!",5
21-01-2021,MadmomMadmom,Yey!,Finally! So happy these these babies back in stock ! I cannot believe my lucky stars! Thanks Walmart!definitely recommend,5
20-01-2021,WalmartCustomerWalmartCustomer,These disinfecting wipes work,"These disinfecting wipes work amazing I use these all around my house to disinfect my door knobs, restroom, my phone and keys.",5
20-01-2021,ZorayaZoraya,,I love it it is my favorite in this time,5
20-01-2021,yoselinyoselin,Packet was damage,It came all spill and wet like if the Clorox came out very disappointed,2
20-01-2021,LouiseLouise,,I hate the smell if you used it to wipe your handsLikesSheetsBathroomFor petsLiquidHealth,5
20-01-2021,ChristineChristine,,I use it on every thing. Clorox is a name to trust,5
20-01-2021,dgrafdgraf,Love these wipes! I,"Love these wipes! I use them throughout my kitchen, they're especially great for cleanup after a little one leaves sticky handprints on the cabinets! I love the scent and I love how well they get everything off!",5
20-01-2021,mchristinammchristinam,I have at least,I have at least three of these In my home at a time. I use this when I clean and disinfect as much as I can I think this product is amazing.,5
20-01-2021,daviddavid,,great! so hard to find and i glad i did these are the best,5
20-01-2021,gimletgimlet,,"arrived on time but leaking , not bad but it was still wet",4
19-01-2021,MarthaMartha,Leaking containers,Received with wet box and liquid leaking.  Labels all wet and peeled off.  Appears items were mashed.,1
19-01-2021,lisam337lisam337,I love Clorox disinfecting,I love Clorox disinfecting wipes. I use them in my bathroom so I can just throw them away and don't have to worry about washing dirty rags. It keeps everything clean and smelling nice.,5
19-01-2021,sandyp46sandyp46,Simply the Best... no,"Simply the Best... no more, no less. Since COVID struck I've been using what I can find. Most stores now have a lot of off brands.",5
19-01-2021,aprils114aprils114,How do you even,"How do you even live without these? They are easy for my kids to clean with and they disinfect,  so it is a win win!! I panic whenever we run out...  Clorox Disinfecting Wipes Bleach Free Cleaning Wipes - Crisp Lemon - 75ct",5
19-01-2021,sexypea48sexypea48,These are good at,These are good at disinfecting but I can't stand the smell. It's so strong! They're also messy when you get to the bottom of the container because those wipes are soaked in the solution and drip everywhere. I don't like getting that stuff on my hands. I much prefer using the spray kind.,3
19-01-2021,ninasbeautyflninasbeautyfl,These work great I,These work great I use them a lot to clean my bathroom they leave a great shine but the bleach smell is so strong in them,5
19-01-2021,baleebalee,"I use at home,","I use at home, at the office and in the car.  I have even used on my phone case! They are convenient and cost effective when purchased in a multi pack",4
19-01-2021,jooheejoohee,These wipes are very,These wipes are very easy to use and keeps everything clean! I use it for the kitchen and high traffic areas to keep things disinfected. Very useful during these COVID times,5
18-01-2021,NoneNone,Clorox disinfect wipes,So glad I could get clorox wipes Thank you Mary P,5
18-01-2021,styleitbynlcstyleitbynlc,Our household definitely uses,Our household definitely uses these on an everyday basis. It's super easy to clean bathrooms and counter tops with these wipes. You can clean surface with 1 cloth and it holds its quality. We couldn't live without these!,5
17-01-2021,jananik1jananik1,It dries off quickly,It dries off quickly and has strong smell which I couldn't bare . But cleans and disinfects very well,3
16-01-2021,mandyl5467mandyl5467,These are great for,These are great for my home and my classroom. With a quick wipe I can assure myself surfaces are safe.,5
16-01-2021,rocioc29rocioc29,This product is truly,"This product is truly wonderful I love it it's very very great and cleans so well ,  which I love and they are all just wonderful it's a yes it's a yes yes yes totally recommend will not regret it and it's amazing. You won't regret buying it!",5
16-01-2021,mwllrmwllr,I love these wipes.,I love these wipes. They are an absolute staple for any house. They are super effective and do their job very well. I wish the packaging was a little bit more convenient as sometimes they get bunched up. Will definitely buy again.,5
15-01-2021,DaisyDaisy,,Damage,1
15-01-2021,SandiSandi,,best product for disinfecting and cleaning,5
15-01-2021,pickanesepickanese,Great product,I keep this in stock so I was prepared when covid 19 happened. Great sanitizer and price is just right.,5
15-01-2021,AngeloAngelo,Horrible when shipped,Wipes were leaking and the packaging was damaged.,2
14-01-2021,yvetteyvette,,Everything was ok minus the fact that the package was already open .,3
14-01-2021,SusanSusan,"Superior, for our circumstances.","Delivered quick, priced as should be, No hassles, no contamination.",5
14-01-2021,mycuratedclosetsmycuratedclosets,Use these on everything!,Use these on everything! Wiping down all surfaces in my home and my car! It really does it all!,5
13-01-2021,audreywhoaaudreywhoa,These wipes are exactly,These wipes are exactly what you need during a pandemic. I trust these wipes and they have a good smell.,5
12-01-2021,TaneeshaTaneesha,,Arrived the next day! Great quality and you will receive every that is shown.,5
12-01-2021,kenj3kenj3,These disinfecting wipes are,These disinfecting wipes are perfect for kids to clean their desk as the end of the day. They kill 99.9% viruses and bacteria. Love the fresh smell as we leave daily.,5
12-01-2021,lizh217lizh217,These are sometimes hard,"These are sometimes hard to find being that we are still pushing through this pandemic. When I do find them, I am happy because these are very efficient and easy to use. I can wipe down counters and doorknobs etc and throw away! The smell is clean, not overwhelming. Thanks Clorox!",5
12-01-2021,kristahd17ckristahd17c,Easy to grab one,Easy to grab one out of the container and quickly wipe things down. These get the job done.,5
12-01-2021,brookea60brookea60,These are a great,These are a great product. Good to use for just about anything and leave a nice fresh sent behind.,3
12-01-2021,SophiaSophia,,Who can go wrong with Clorox wipes right now during the pandemic? I have been lucky enough to be able to stay stocked with wipes so that I can keep my family safe.,5
11-01-2021,owingslrowingslr,Works great and smells,Works great and smells clean. I buy multiples to keep in the house/car/work etc. Good disinfectant that I completely trust.,4
11-01-2021,rachelchloerachelchloe,We use these at,We use these at work constantly. I don't feel like many people realize though that the chemicals take about 90 seconds before it works,3
11-01-2021,WalmartCustomerWalmartCustomer,Every single time we,"Every single time we see them on the shelves we buy them. In the life of covid, carrying the wipes around make me feel cleaner in public. I can focus on disinfecting surfaces myself to protect myself and my family in social situations.",5
11-01-2021,heatherm401heatherm401,These are my favorite,"These are my favorite quick and easy product to always have on hand. At home I love to use them for wiping down the sides, back and seat of my child's high chair and door handles. I always have some in the car for sanitizing carts before walking into a store.",5
09-01-2021,tracyb68tracyb68,Nice to wipe things,Nice to wipe things down. Quick and easy to use. I grab a couple to wipe down door handles around the house fairly frequently to prevent getting Covid.,5
08-01-2021,1aurenmac1aurenmac,I love the convenience,I love the convenience of a disinfectant wipe! It just helps keeping things clean after a long day a little easier. I love wiping down my kitchen and bathroom counters with these wipes in between cleanings.,5
08-01-2021,CharlesCharles,Product needs to be sold to Everyone,"Great product, badly needed for general population not just health care facilities, business who are overpricing this product for more money",5
08-01-2021,shevonhshevonh,"These work great, have","These work great, have plenty of product on them & don't dry out as easily. This particular scent is good & strong & they clean so well.",4
07-01-2021,heyitsbrittheyitsbritt,My favorite go to,"My favorite go to cleaning product because I can use on almost every surface! They don't have a nasty smell and get things super clean and germ free. I can use in my kitchen counter, sinks around bathroom tubs, on the toilets, on walls, doors; overall they are life savers you don't have to spray something that's dangerous for pets or children but you can clean every surface and it looks sparkly clean.",5
07-01-2021,mms526mms526,I feel good that,I feel good that I'm keeping my house clean with these on hand. I question if knock offs have the same claims so try to stick to Clorox if I can.,5
07-01-2021,aliciamariedb7cf087aliciamariedb7cf087,Always great. I love,Always great. I love how clean everything feels after using these. I don't always love how chemical it smells,4
06-01-2021,megvishmegvish,Whoever knew that three,"Whoever knew that three year of 2019 would be the year of Clorox wipes, sanitizer and toilet paper. When I find these in stores nowadays it's like striking gold. I love these just to give everything a solid clean. You know these do the job and get rid of the germs.",5
06-01-2021,stickvacuumuserstickvacuumuser,Lucky to Find,"Hard to find item, but worth the wait and search.",5
03-01-2021,annemarieokannemarieok,"What can I say,","What can I say, when there's a potentially killer virus looming you go with the trusted name. And when you're lazy you go with wipes. These don't dry out in the canister and they hold the product instead of the other drippy brands. Luckily I was on auto ship before the hoarding started so my stash lasted a long time. This also doesn't dry out your hands.",5
